{
  "art": {
    "big": "assets/art/big/75.png",
    "small": null
  },
  "audio": "assets/sounds/75.wav",
  "cost": {
    "primary": null,
    "secondary": null,
    "tertiary": null,
    "total": null
  },
  "effect_record_id": null,
  "id": 75,
  "keywords": [],
  "name": "Lightning Bolt",
  "rarity": null,
  "related_card_id": null,
  "rules_text": "Cast on minion. Minion takes five hit points of damage.",
  "set": null,
  "sources": {
    "card_text_file": "CardTextC.txt",
    "card_text_line": 52,
    "ncd_row": 52
  },
  "starter_decks": [],
  "stats": null,
  "target": "minion",
  "type": "manipulation"
}
