{
  "art": null,
  "audio": null,
  "cost": {
    "primary": null,
    "secondary": null,
    "tertiary": null,
    "total": null
  },
  "effect_record_id": null,
  "id": 86,
  "keywords": [],
  "name": "Plains",
  "rarity": null,
  "related_card_id": null,
  "rules_text": "Cast on square. Square becomes plains.",
  "set": null,
  "sources": {
    "card_text_file": "CardTextC.txt",
    "card_text_line": 62,
    "ncd_row": 62
  },
  "starter_decks": [],
  "stats": null,
  "target": "square",
  "type": "manipulation"
}
