{
  "art": null,
  "audio": null,
  "cost": {
    "primary": null,
    "secondary": null,
    "tertiary": null,
    "total": null
  },
  "effect_record_id": null,
  "id": 610,
  "keywords": [],
  "name": "Syzygy",
  "rarity": null,
  "related_card_id": null,
  "rules_text": "Cast on globe. Next turn, caster has all spell casting costs adjusted by -1 primary and -1 secondary mana of caster's mana types per spell.",
  "set": null,
  "sources": {
    "card_text_file": "CardTextW.txt",
    "card_text_line": 10,
    "ncd_row": 349
  },
  "starter_decks": [],
  "stats": null,
  "target": "globe",
  "type": "manipulation"
}
