{
  "art": {
    "big": "assets/art/big/917.png",
    "small": null
  },
  "audio": null,
  "cost": {
    "primary": null,
    "secondary": null,
    "tertiary": null,
    "total": null
  },
  "effect_record_id": null,
  "id": 917,
  "keywords": [],
  "name": "Rust",
  "rarity": null,
  "related_card_id": null,
  "rules_text": "Cast on town or colony. Recruits get -1 armor while in structure. Dispelled at end of next combat or if structure is captured.",
  "set": null,
  "sources": {
    "card_text_file": "CardTextR.txt",
    "card_text_line": 117,
    "ncd_row": 505
  },
  "starter_decks": [],
  "stats": null,
  "target": "structure",
  "type": "conjuration"
}
