{
  "art": null,
  "audio": null,
  "cost": {
    "primary": null,
    "secondary": null,
    "tertiary": null,
    "total": null
  },
  "effect_record_id": null,
  "id": 505,
  "keywords": [],
  "name": "Djibari's Legacy",
  "rarity": null,
  "related_card_id": null,
  "rules_text": "Cast on globe. All new novices created are Imps.",
  "set": null,
  "sources": {
    "card_text_file": "CardTextO.txt",
    "card_text_line": 5,
    "ncd_row": 258
  },
  "starter_decks": [],
  "stats": null,
  "target": "globe",
  "type": "alteration"
}
