{
  "art": {
    "big": "assets/art/big/507.png",
    "small": null
  },
  "audio": null,
  "cost": {
    "primary": null,
    "secondary": null,
    "tertiary": null,
    "total": null
  },
  "effect_record_id": null,
  "id": 507,
  "keywords": [],
  "name": "Bilious Rage",
  "rarity": null,
  "related_card_id": null,
  "rules_text": "Cast on recruit. Recruit gets +1 hand and missile damage, or +2 damage against Satyrs.",
  "set": null,
  "sources": {
    "card_text_file": "CardTextO.txt",
    "card_text_line": 7,
    "ncd_row": 260
  },
  "starter_decks": [],
  "stats": null,
  "target": "recruit",
  "type": "alteration"
}
