{
  "art": {
    "big": "assets/art/big/1040.png",
    "small": null
  },
  "audio": "assets/sounds/1040.wav",
  "cost": {
    "primary": null,
    "secondary": null,
    "tertiary": null,
    "total": null
  },
  "effect_record_id": null,
  "id": 1040,
  "keywords": [],
  "name": "Breaking the Chains",
  "rarity": null,
  "related_card_id": null,
  "rules_text": "Cast on friendly minion. Dispels all non-friendly individual spells on minion.",
  "set": null,
  "sources": {
    "card_text_file": "CardTextA.txt",
    "card_text_line": 41,
    "ncd_row": 557
  },
  "starter_decks": [],
  "stats": null,
  "target": "minion",
  "type": "manipulation"
}
