{
  "art": null,
  "audio": null,
  "cost": {
    "primary": null,
    "secondary": null,
    "tertiary": null,
    "total": null
  },
  "effect_record_id": null,
  "id": 914,
  "keywords": [],
  "name": "Magnetic Accrual",
  "rarity": null,
  "related_card_id": null,
  "rules_text": "Cast on recruit. Recruit absorbs all armor from its group. (Every other recruit gets -A armor, where A is its armor when Magnetic Accrual enters play. Target recruit gets +N armor, where N is the sum of all A's. These stat changes cannot be dispelled.)",
  "set": null,
  "sources": {
    "card_text_file": "CardTextR.txt",
    "card_text_line": 114,
    "ncd_row": 502
  },
  "starter_decks": [],
  "stats": null,
  "target": "recruit",
  "type": "manipulation"
}
