{
  "art": {
    "big": "assets/art/big/135.png",
    "small": null
  },
  "audio": null,
  "cost": {
    "primary": null,
    "secondary": null,
    "tertiary": null,
    "total": null
  },
  "effect_record_id": null,
  "id": 135,
  "keywords": [],
  "name": "Kumatru Archer",
  "rarity": null,
  "related_card_id": null,
  "rules_text": "Cast on archer. Archer gets +2 missile damage.",
  "set": null,
  "sources": {
    "card_text_file": "CardTextC.txt",
    "card_text_line": 97,
    "ncd_row": 97
  },
  "starter_decks": [],
  "stats": null,
  "target": "recruit",
  "type": "alteration"
}
